docker : 2026-01-06 16:50:0
5,028 - freqtrade - INFO - 
freqtrade 2025.11.2
At line:1 char:1
+ docker run --rm -v "${PWD
}/user_data:/freqtrade/user
_data" freqtradeo ...
+ ~~~~~~~~~~~~~~~~~~~~~~~~~
~~~~~~~~~~~~~~~~~~~~~~~~~~~
~~~~~~~~~~~~~~~~~
    + CategoryInfo         
     : NotSpecified: (202  
  6-01-06 16:5...trade 2   
 025.11.2:String) [], R    
emoteException
    + FullyQualifiedErrorI 
   d : NativeCommandError
 
2026-01-06 16:50:05,496 - n
umexpr.utils - INFO - NumEx
pr defaulting to 16 threads
.
2026-01-06 16:50:06,623 - f
reqtrade.configuration.load
_config - INFO - Using conf
ig: /freqtrade/user_data/co
nfigs/config_aggressive.jso
n ...
2026-01-06 16:50:06,629 - f
reqtrade.loggers - INFO - E
nabling colorized output.
2026-01-06 16:50:06,629 - f
reqtrade.loggers - INFO - L
ogfile configured
2026-01-06 16:50:06,629 - f
reqtrade.loggers - INFO - V
erbosity set to 0
2026-01-06 16:50:06,630 - f
reqtrade.configuration.conf
iguration - INFO - Using ma
x_open_trades: 5 ...
2026-01-06 16:50:06,630 - f
reqtrade.configuration.conf
iguration - INFO - Paramete
r --timerange detected: 202
30101-20260101 ...
2026-01-06 16:50:07,269 - f
reqtrade.configuration.conf
iguration - INFO - Using us
er-data directory: /freqtra
de/user_data ...
2026-01-06 16:50:07,271 - f
reqtrade.configuration.conf
iguration - INFO - Using da
ta directory: /freqtrade/us
er_data/data/binance ...
2026-01-06 16:50:07,271 - f
reqtrade.configuration.conf
iguration - INFO - Paramete
r --epochs detected ... Wil
l run Hyperopt with for 60 
epochs ...
2026-01-06 16:50:07,271 - f
reqtrade.configuration.conf
iguration - INFO - Paramete
r -s/--spaces detected: ['b
uy']
2026-01-06 16:50:07,272 - f
reqtrade.configuration.conf
iguration - INFO - Paramete
r -j/--job-workers detected
: 1
2026-01-06 16:50:07,272 - f
reqtrade.configuration.conf
iguration - INFO - Paramete
r --min-trades detected: 1
2026-01-06 16:50:07,272 - f
reqtrade.configuration.conf
iguration - INFO - Using Hy
peropt loss class name: Sor
tinoHyperOptLoss
2026-01-06 16:50:07,272 - f
reqtrade.configuration.conf
iguration - INFO - Filter t
rades by timerange: 2023010
1-20260101
2026-01-06 16:50:07,273 - f
reqtrade.exchange.check_exc
hange - INFO - Checking exc
hange...
2026-01-06 16:50:07,282 - f
reqtrade.exchange.check_exc
hange - INFO - Exchange "bi
nance" is officially suppor
ted by the Freqtrade develo
pment team.
2026-01-06 16:50:07,283 - f
reqtrade.configuration.conf
iguration - INFO - Using pa
irlist from configuration.
2026-01-06 16:50:07,283 - f
reqtrade.configuration.conf
ig_validation - INFO - Vali
dating configuration ...
2026-01-06 16:50:07,284 - f
reqtrade.commands.optimize_
commands - INFO - Starting 
freqtrade in Hyperopt mode
2026-01-06 16:50:07,289 - f
reqtrade.optimize.hyperopt.
hyperopt - INFO - Removing 
`/freqtrade/user_data/hyper
opt_results/hyperopt_ticker
data.pkl`.
2026-01-06 16:50:07,293 - f
reqtrade.exchange.exchange 
- INFO - Instance is runnin
g with dry_run enabled
2026-01-06 16:50:07,293 - f
reqtrade.exchange.exchange 
- INFO - Using CCXT 4.5.27
2026-01-06 16:50:07,308 - f
reqtrade.exchange.exchange 
- INFO - Using Exchange "Bi
nance"
2026-01-06 16:50:09,642 - f
reqtrade.resolvers.exchange
_resolver - INFO - Using re
solved exchange 'Binance'..
.
2026-01-06 16:50:09,768 - f
reqtrade.resolvers.iresolve
r - INFO - Using resolved s
trategy EPASuperTrendAggres
sive from '/freqtrade/user_
data/strategies/EPASuperTre
ndAggressive.py'...
2026-01-06 16:50:09,769 - f
reqtrade.strategy.hyper - I
NFO - Found no parameter fi
le.
2026-01-06 16:50:09,769 - f
reqtrade.resolvers.strategy
_resolver - INFO - Override
 strategy 'stake_currency' 
with value from the configu
ration: USDT.
2026-01-06 16:50:09,770 - f
reqtrade.resolvers.strategy
_resolver - INFO - Override
 strategy 'stake_amount' wi
th value from the configura
tion: unlimited.
2026-01-06 16:50:09,770 - f
reqtrade.resolvers.strategy
_resolver - INFO - Override
 strategy 'unfilledtimeout'
 with value from the config
uration: {'entry': 10, 'exi
t': 10, 'unit': 'minutes', 
'exit_timeout_count': 0}.
2026-01-06 16:50:09,770 - f
reqtrade.resolvers.strategy
_resolver - INFO - Override
 strategy 'max_open_trades'
 with value from the config
uration: 5.
2026-01-06 16:50:09,770 - f
reqtrade.resolvers.strategy
_resolver - INFO - Strategy
 using minimal_roi: {'0': 0
.1, '60': 0.06, '120': 0.04
, '240': 0.02, '360': 0.01}
2026-01-06 16:50:09,771 - f
reqtrade.resolvers.strategy
_resolver - INFO - Strategy
 using timeframe: 2h
2026-01-06 16:50:09,771 - f
reqtrade.resolvers.strategy
_resolver - INFO - Strategy
 using stoploss: -0.06
2026-01-06 16:50:09,772 - f
reqtrade.resolvers.strategy
_resolver - INFO - Strategy
 using trailing_stop: True
2026-01-06 16:50:09,772 - f
reqtrade.resolvers.strategy
_resolver - INFO - Strategy
 using trailing_stop_positi
ve: 0.02
2026-01-06 16:50:09,772 - f
reqtrade.resolvers.strategy
_resolver - INFO - Strategy
 using trailing_stop_positi
ve_offset: 0.03
2026-01-06 16:50:09,773 - f
reqtrade.resolvers.strategy
_resolver - INFO - Strategy
 using trailing_only_offset
_is_reached: True
2026-01-06 16:50:09,773 - f
reqtrade.resolvers.strategy
_resolver - INFO - Strategy
 using use_custom_stoploss:
 False
2026-01-06 16:50:09,774 - f
reqtrade.resolvers.strategy
_resolver - INFO - Strategy
 using process_only_new_can
dles: True
2026-01-06 16:50:09,774 - f
reqtrade.resolvers.strategy
_resolver - INFO - Strategy
 using order_types: {'entry
': 'limit', 'exit': 'limit'
, 'stoploss': 'limit', 'sto
ploss_on_exchange': False, 
'stoploss_on_exchange_inter
val': 60}
2026-01-06 16:50:09,774 - f
reqtrade.resolvers.strategy
_resolver - INFO - Strategy
 using order_time_in_force:
 {'entry': 'GTC', 'exit': '
GTC'}
2026-01-06 16:50:09,775 - f
reqtrade.resolvers.strategy
_resolver - INFO - Strategy
 using stake_currency: USDT
2026-01-06 16:50:09,775 - f
reqtrade.resolvers.strategy
_resolver - INFO - Strategy
 using stake_amount: unlimi
ted
2026-01-06 16:50:09,775 - f
reqtrade.resolvers.strategy
_resolver - INFO - Strategy
 using startup_candle_count
: 50
2026-01-06 16:50:09,776 - f
reqtrade.resolvers.strategy
_resolver - INFO - Strategy
 using unfilledtimeout: {'e
ntry': 10, 'exit': 10, 'uni
t': 'minutes', 'exit_timeou
t_count': 0}
2026-01-06 16:50:09,776 - f
reqtrade.resolvers.strategy
_resolver - INFO - Strategy
 using use_exit_signal: Fal
se
2026-01-06 16:50:09,776 - f
reqtrade.resolvers.strategy
_resolver - INFO - Strategy
 using exit_profit_only: Fa
lse
2026-01-06 16:50:09,776 - f
reqtrade.resolvers.strategy
_resolver - INFO - Strategy
 using ignore_roi_if_entry_
signal: False
2026-01-06 16:50:09,777 - f
reqtrade.resolvers.strategy
_resolver - INFO - Strategy
 using exit_profit_offset: 
0.0
2026-01-06 16:50:09,777 - f
reqtrade.resolvers.strategy
_resolver - INFO - Strategy
 using disable_dataframe_ch
ecks: False
2026-01-06 16:50:09,777 - f
reqtrade.resolvers.strategy
_resolver - INFO - Strategy
 using ignore_buying_expire
d_candle_after: 0
2026-01-06 16:50:09,778 - f
reqtrade.resolvers.strategy
_resolver - INFO - Strategy
 using position_adjustment_
enable: False
2026-01-06 16:50:09,778 - f
reqtrade.resolvers.strategy
_resolver - INFO - Strategy
 using max_entry_position_a
djustment: -1
2026-01-06 16:50:09,779 - f
reqtrade.resolvers.strategy
_resolver - INFO - Strategy
 using max_open_trades: 5
2026-01-06 16:50:09,779 - f
reqtrade.configuration.conf
ig_validation - INFO - Vali
dating configuration ...
2026-01-06 16:50:09,784 - f
reqtrade.resolvers.iresolve
r - INFO - Using resolved p
airlist StaticPairList from
 '/freqtrade/freqtrade/plug
ins/pairlist/StaticPairList
.py'...
2026-01-06 16:50:09,811 - f
reqtrade.optimize.backtesti
ng - INFO - Using fee 0.100
0% - worst case fee from ex
change (lowest tier).
2026-01-06 16:50:09,812 - f
reqtrade.strategy.hyper - I
NFO - No params for buy fou
nd, using default values.
2026-01-06 16:50:09,813 - f
reqtrade.strategy.hyper - I
NFO - Strategy Parameter(de
fault): buy_st_multiplier =
 3.0
2026-01-06 16:50:09,813 - f
reqtrade.strategy.hyper - I
NFO - Strategy Parameter(de
fault): buy_st_period = 10
2026-01-06 16:50:09,819 - f
reqtrade.resolvers.iresolve
r - INFO - Using resolved h
yperoptloss SortinoHyperOpt
Loss from '/freqtrade/freqt
rade/optimize/hyperopt_loss
/hyperopt_loss_sortino.py'.
..
2026-01-06 16:50:10,220 - f
reqtrade.optimize.hyperopt.
hyperopt_optimizer - INFO -
 manager queue <class 'mult
iprocessing.managers.AutoPr
oxy[Queue]'>
2026-01-06 16:50:10,221 - f
reqtrade.optimize.hyperopt.
hyperopt - INFO - Using opt
imizer random state: 3272
2026-01-06 16:50:10,266 - f
reqtrade.data.history.datah
andlers.idatahandler - WARN
ING - BTC/USDT, spot, 2h, d
ata starts at 2023-01-01 00
:00:00
2026-01-06 16:50:10,310 - f
reqtrade.data.history.datah
andlers.idatahandler - WARN
ING - ETH/USDT, spot, 2h, d
ata starts at 2023-01-01 00
:00:00
2026-01-06 16:50:10,347 - f
reqtrade.data.history.datah
andlers.idatahandler - WARN
ING - SOL/USDT, spot, 2h, d
ata starts at 2023-01-01 00
:00:00
2026-01-06 16:50:10,383 - f
reqtrade.data.history.datah
andlers.idatahandler - WARN
ING - BNB/USDT, spot, 2h, d
ata starts at 2023-01-01 00
:00:00
2026-01-06 16:50:10,421 - f
reqtrade.data.history.datah
andlers.idatahandler - WARN
ING - XRP/USDT, spot, 2h, d
ata starts at 2023-01-01 00
:00:00
2026-01-06 16:50:10,459 - f
reqtrade.data.history.datah
andlers.idatahandler - WARN
ING - DOGE/USDT, spot, 2h, 
data starts at 2024-01-01 0
0:00:00
2026-01-06 16:50:10,492 - f
reqtrade.data.history.datah
andlers.idatahandler - WARN
ING - AVAX/USDT, spot, 2h, 
data starts at 2024-01-01 0
0:00:00
2026-01-06 16:50:10,501 - f
reqtrade.optimize.backtesti
ng - INFO - Loading data fr
om 2023-01-01 00:00:00 up t
o 2026-01-01 00:00:00 (1096
 days).
2026-01-06 16:50:10,501 - f
reqtrade.configuration.time
range - WARNING - Moving st
art-date by 50 candles to a
ccount for startup time.
2026-01-06 16:50:10,942 - f
reqtrade.optimize.hyperopt.
hyperopt_optimizer - INFO -
 Dataload complete. Calcula
ting indicators
2026-01-06 16:53:01,106 - f
reqtrade.optimize.hyperopt.
hyperopt_optimizer - INFO -
 Hyperopting with data from
 2023-01-05 04:00:00 up to 
2026-01-01 00:00:00 (1091 d
ays)..
2026-01-06 16:53:01,555 - f
reqtrade.optimize.hyperopt.
hyperopt - INFO - Found 16 
CPU cores. Let's make them 
scream!
2026-01-06 16:53:01,555 - f
reqtrade.optimize.hyperopt.
hyperopt - INFO - Number of
 parallel jobs set as: 1
2026-01-06 16:53:01,557 - f
reqtrade.optimize.hyperopt.
hyperopt_optimizer - INFO -
 Using optuna sampler NSGAI
IISampler.
[I 2026-01-06 16:53:01,557]
 A new study created in mem
ory with name: no-name-a1fe
b651-c8e6-4b3e-8366-fe6ef24
d9934
2026-01-06 16:53:01,558 - f
reqtrade.optimize.hyperopt.
hyperopt - INFO - Effective
 number of parallel workers
 used: 1
2026-01-06 16:53:21,676 - f
reqtrade.optimize.hyperopt.
hyperopt - WARNING - Duplic
ate params detected. Maybe 
your search space is too sm
all?
                           
                           
                           
          Hyperopt results 
                           
                           
                           
           
                          Ô
öÅÔöüÔöüÔöüÔöüÔöüÔöüÔöüÔöüÔ
ö│ÔöüÔöüÔöüÔöüÔöüÔöüÔöüÔö│Ô
öüÔöüÔöüÔöüÔöüÔöüÔöüÔöüÔö│Ô
öüÔöüÔöüÔöüÔöüÔöüÔöüÔöüÔöüÔ
öüÔöüÔöüÔöüÔöüÔöüÔöüÔöüÔöüÔ
öüÔöüÔöüÔöüÔöüÔöüÔö│ÔöüÔöüÔ
öüÔöüÔöüÔöüÔöüÔöüÔöüÔöüÔöüÔ
öüÔö│ÔöüÔöüÔöüÔöüÔöüÔöüÔöüÔ
öüÔöüÔöüÔöüÔöüÔöüÔöüÔöüÔöüÔ
öüÔöüÔöüÔöüÔöüÔöüÔöüÔöüÔöüÔ
öüÔö│ÔöüÔöüÔöüÔöüÔöüÔöüÔöüÔ
öüÔöüÔöüÔöüÔöüÔöüÔöüÔöüÔöüÔ
ö│ÔöüÔöüÔöüÔöüÔöüÔöüÔöüÔöüÔ
öüÔöüÔöüÔö│ÔöüÔöüÔöüÔöüÔöüÔ
öüÔöüÔöüÔöüÔöüÔöüÔöüÔöüÔöüÔ
öüÔöüÔöüÔöüÔöüÔöüÔöüÔöüÔöüÔ
öüÔöüÔöô                   
        
                          Ô
öâ Best   Ôöâ Epoch Ôöâ Tra
des Ôöâ  Win  Draw  Loss  W
in% Ôöâ Avg profit Ôöâ     
              Profit Ôöâ   
Avg duration Ôöâ Objective 
Ôöâ     Max Drawdown (Acct)
 Ôöâ                       
    
                          Ô
öíÔöüÔöüÔöüÔöüÔöüÔöüÔöüÔöüÔ
òçÔöüÔöüÔöüÔöüÔöüÔöüÔöüÔòçÔ
öüÔöüÔöüÔöüÔöüÔöüÔöüÔöüÔòçÔ
öüÔöüÔöüÔöüÔöüÔöüÔöüÔöüÔöüÔ
öüÔöüÔöüÔöüÔöüÔöüÔöüÔöüÔöüÔ
öüÔöüÔöüÔöüÔöüÔöüÔòçÔöüÔöüÔ
öüÔöüÔöüÔöüÔöüÔöüÔöüÔöüÔöüÔ
öüÔòçÔöüÔöüÔöüÔöüÔöüÔöüÔöüÔ
öüÔöüÔöüÔöüÔöüÔöüÔöüÔöüÔöüÔ
öüÔöüÔöüÔöüÔöüÔöüÔöüÔöüÔöüÔ
öüÔòçÔöüÔöüÔöüÔöüÔöüÔöüÔöüÔ
öüÔöüÔöüÔöüÔöüÔöüÔöüÔöüÔöüÔ
òçÔöüÔöüÔöüÔöüÔöüÔöüÔöüÔöüÔ
öüÔöüÔöüÔòçÔöüÔöüÔöüÔöüÔöüÔ
öüÔöüÔöüÔöüÔöüÔöüÔöüÔöüÔöüÔ
öüÔöüÔöüÔöüÔöüÔöüÔöüÔöüÔöüÔ
öüÔöüÔö®                   
        
                          Ô
öé * Best Ôöé  1/60 Ôöé   1
084 Ôöé  855     0   229  7
8.9 Ôöé     -0.32% Ôöé -878
.284 USDT  (-43.91%) Ôöé 1 
day, 4:36:00 Ôöé   3.66196 
Ôöé 911.929 USDT   (44.93%)
 Ôöé                       
    
                          Ô
öé * Best Ôöé  2/60 Ôöé   1
106 Ôöé  877     0   229  7
9.3 Ôöé     -0.29% Ôöé -810
.874 USDT  (-40.54%) Ôöé 1 
day, 3:32:00 Ôöé   3.31659 
Ôöé 837.078 USDT   (41.34%)
 Ôöé                       
    
                          Ô
öé * Best Ôöé  6/60 Ôöé    
672 Ôöé  540     0   132  8
0.4 Ôöé     -0.21% Ôöé -364
.517 USDT  (-18.23%) Ôöé 1 
day, 5:03:00 Ôöé   1.39878 
Ôöé 492.348 USDT   (23.25%)
 Ôöé                       
    
                          Ô
öé * Best Ôöé 20/60 Ôöé    
680 Ôöé  551     0   129  8
1.0 Ôöé     -0.15% Ôöé -260
.202 USDT  (-13.01%) Ôöé 1 
day, 4:32:00 Ôöé   0.96192 
Ôöé 502.205 USDT   (22.59%)
 Ôöé                       
    
                          Ô
öé * Best Ôöé 23/60 Ôöé    
681 Ôöé  558     0   123  8
1.9 Ôöé     -0.08% Ôöé -124
.721 USDT   (-6.24%) Ôöé 1 
day, 4:41:00 Ôöé   0.46371 
Ôöé 405.665 USDT   (17.78%)
 Ôöé                       
    
                          Ô
ööÔöÇÔöÇÔöÇÔöÇÔöÇÔöÇÔöÇÔöÇÔ
ö┤ÔöÇÔöÇÔöÇÔöÇÔöÇÔöÇÔöÇÔö┤Ô
öÇÔöÇÔöÇÔöÇÔöÇÔöÇÔöÇÔöÇÔö┤Ô
öÇÔöÇÔöÇÔöÇÔöÇÔöÇÔöÇÔöÇÔöÇÔ
öÇÔöÇÔöÇÔöÇÔöÇÔöÇÔöÇÔöÇÔöÇÔ
öÇÔöÇÔöÇÔöÇÔöÇÔöÇÔö┤ÔöÇÔöÇÔ
öÇÔöÇÔöÇÔöÇÔöÇÔöÇÔöÇÔöÇÔöÇÔ
öÇÔö┤ÔöÇÔöÇÔöÇÔöÇÔöÇÔöÇÔöÇÔ
öÇÔöÇÔöÇÔöÇÔöÇÔöÇÔöÇÔöÇÔöÇÔ
öÇÔöÇÔöÇÔöÇÔöÇÔöÇÔöÇÔöÇÔöÇÔ
öÇÔö┤ÔöÇÔöÇÔöÇÔöÇÔöÇÔöÇÔöÇÔ
öÇÔöÇÔöÇÔöÇÔöÇÔöÇÔöÇÔöÇÔöÇÔ
ö┤ÔöÇÔöÇÔöÇÔöÇÔöÇÔöÇÔöÇÔöÇÔ
öÇÔöÇÔöÇÔö┤ÔöÇÔöÇÔöÇÔöÇÔöÇÔ
öÇÔöÇÔöÇÔöÇÔöÇÔöÇÔöÇÔöÇÔöÇÔ
öÇÔöÇÔöÇÔöÇÔöÇÔöÇÔöÇÔöÇÔöÇÔ
öÇÔöÇÔöİ                   
        
Epochs ÔöüÔöüÔöüÔöüÔöüÔöüÔö
üÔöüÔöüÔöüÔöüÔöüÔöüÔöüÔöüÔö
üÔöüÔöüÔöüÔöüÔöüÔöüÔöüÔöüÔö
üÔöüÔöüÔöüÔöüÔöüÔöüÔöüÔöüÔö
üÔöüÔöüÔöüÔöüÔöüÔöüÔöüÔöüÔö
üÔöüÔöüÔöüÔöüÔöüÔöüÔöüÔöüÔö
üÔöüÔöüÔöüÔöüÔöüÔöüÔöüÔöüÔö
üÔöüÔöüÔöüÔò©              
                           
                           
                           
   24/60  40% ÔÇó 0:00:56 Ô
Çó 0:01:17
2026-01-06 16:53:58,274 - f
reqtrade.optimize.hyperopt.
hyperopt - INFO - 36 epochs
 skipped due to duplicate p
arameters.
2026-01-06 16:53:58,274 - f
reqtrade.optimize.hyperopt.
hyperopt - INFO - 24 epochs
 saved to '/freqtrade/user_
data/hyperopt_results/strat
egy_EPASuperTrendAggressive
_2026-01-06_16-50-07.fthypt
'.
2026-01-06 16:53:58,591 - s
mc_indicators - WARNING - s
martmoneyconcepts not insta
lled. Run: pip install smar
tmoneyconcepts
2026-01-06 16:53:58,621 - s
mc_indicators - WARNING - s
martmoneyconcepts not insta
lled. Run: pip install smar
tmoneyconcepts
2026-01-06 16:53:58,622 - f
reqtrade.optimize.hyperopt_
tools - INFO - Dumping para
meters to /freqtrade/user_d
ata/strategies/EPASuperTren
dAggressive.json

Best result:

*   23/60:    681 trades. 558/0/123 Wins/Draws/Losses. Avg profit  -0.08%. Median profit   1.00%. Total profit -124.72120616 USDT (  -6.24%). Avg duration 1 day, 4:41:00 min. Objective: 0.46371


    # Buy parameters:
    buy_params = {
        "buy_st_multiplier": 3.5,
        "buy_st_period": 16,
    }

    # ROI parameters:  # value loaded from strategy
    minimal_roi = {
        "0": 0.1,
        "60": 0.06,
        "120": 0.04,
        "240": 0.02,
        "360": 0.01
    }

    # Stoploss parameters:
    stoploss = -0.06  # value loaded from strategy

    # Trailing stop parameters:
    trailing_stop = True  # value loaded from strategy
    trailing_stop_positive = 0.02  # value loaded from strategy
    trailing_stop_positive_offset = 0.03  # value loaded from strategy
    trailing_only_offset_is_reached = True  # value loaded from strategy
    

    # max_open_trades parameters:
    max_open_trades = 5  # value loaded from strategy
